{
  "$schema": "https://json-schema.org/draft/2020-12/schema",
  "type": "object",
  "required": [
    "contract_version",
    "word",
    "meaning",
    "usage",
    "example",
    "review_suggestion",
    "limitations"
  ],
  "properties": {
    "contract_version": {"const": 1},
    "word": {"type": "string", "minLength": 1},
    "meaning": {"type": "string", "minLength": 1},
    "usage": {"type": "string", "minLength": 1},
    "collocations": {
      "type": "array",
      "maxItems": 4,
      "items": {"type": "string", "minLength": 1}
    },
    "example": {"type": "string", "minLength": 1},
    "review_suggestion": {
      "type": "object",
      "required": ["suggested", "kind"],
      "properties": {
        "suggested": {"type": "boolean"},
        "kind": {"enum": ["recall_sentence", "fill_context", "spaced_review", "none"]}
      },
      "additionalProperties": false
    },
    "limitations": {
      "type": "array",
      "items": {"type": "string", "minLength": 1}
    }
  },
  "additionalProperties": false
}
